Scraped Date,Job Title,Job Description,Location,Additional Locations,Posted Date,Job ID,Remote Type,Application URL
2026-06-29,"Executive Assistant, FPRS","The Executive Assistant will support the Head of Financial Protection & Retirement Solutions and one additional senior executive on the team. The role requires high emotional intelligence and interpersonal skills, highly technical capability with suite of tools, an incredible work ethic, and the ability to proactively anticipate and manage a variety of executive needs. The Executive Assistant will exercise considerable discretion in judgment and confidentiality and will possess the organizational skills to support the varied tasks and deadlines that are required daily. The successful candidate will have the opportunity to work closely with senior leadership and play a key role in the success of the organization. You will Provide proactive level of executive administrative support, ensuring excellent service and professionalism with every interaction. Demonstrate ability to solve problems and bring forward recommended solutions. Consistently demonstrate excellent judgment, and integrity, exhibiting a high level of confidentiality, discretion and diplomacy when dealing with sensitive correspondence, issues, and information. Coordinate all travel arrangements (flights, car service, hotel reservations, etc.) and process reimbursable expenses in a timely manner. Proactively manage calendar, schedule meetings, arrange meeting logistics and resolve calendar conflicts. Interact with executives and assistants internally and externally, responding to requests with an appropriate sense of urgency. Prioritize and manage your own workflow to ensure quality and efficiency to meet deadlines and be flexible in adjusting to changing work priorities. Proactively address, or resolve issues, within own area of accountability and keep leadership informed of any matters requiring their attention. Collaborate with sourcing team and other necessary parties to initiate purchase orders (PO) and manage vendor payments effectively. Prepare correspondence, reports, presentations, and other materials, ensuring deadlines are met. Assist with other special projects, perform additional assignments, as needed – growth mindset. You have Bachelor’s degree in business administration, related field, or relevant experiences. 5+ years of experience as an Executive Assistant supporting C-suite level senior executives. Organizationally savvy, with keen ability to read sensitive situations and respond effectively. Strong knowledge of all audio visual set up (i.e., video conferencing) and ability to successfully collaborate with AV team as dictated by meeting requirements. Excellent communication skills, both written and verbal. Strong organizational skills and attention to detail. Ability to multitask and manage competing priorities. Proficient in Microsoft Office Suite (Word, Excel, PowerPoint, Outlook). Experience in project management and event coordination. Ability to maintain confidentiality and handle sensitive information. Ability to work independently and as part of a team. Flexibility to work outside of regular business hours when needed. Flexibility to travel as needed to offsite meetings, key events etc (10% of time maximum) Location/Travel Hybrid role – 3 days in office, 2 days WFH. Location - Hudson Yards. Salary Range: $81,580.00 - $122,365.00 The salary range reflected above is a good faith estimate of base pay for the primary location of the position. The salary for this position ultimately will be determined based on the education, experience, knowledge, and abilities of the successful candidate. In addition to salary, this role may also be eligible for annual, sales, or other incentive compensation. Our Promise At Guardian, you’ll have the support and flexibility to achieve your professional and personal goals.  Through skill-building, leadership development and philanthropic opportunities, we provide opportunities to build communities and grow your career, surrounded by diverse colleagues with high ethical standards. Inspire Well-Being As part of Guardian’s Purpose – to inspire well-being – we are committed to offering contemporary, supportive, flexible, and inclusive benefits and resources to our colleagues. Explore our company benefits at www.guardianlife.com/careers/corporate/benefits . Benefits apply to full-time eligible employees. Interns are not eligible for most Company benefits. Equal Employment Opportunity Guardian is an equal opportunity employer. All qualified applicants will be considered for employment without regard to age, race, color, creed, religion, sex, affectional or sexual orientation, national origin, ancestry, marital status, disability, military or veteran status, or any other classification protected by applicable law. Accommodations Guardian is committed to providing access, equal opportunity and reasonable accommodation for individuals with disabilities in employment, its services, programs, and activities. Guardian also provides reasonable accommodations to qualified job applicants (and employees) to accommodate the individual's known limitations related to pregnancy, childbirth, or related medical conditions, unless doing so would create an undue hardship. If reasonable accommodation is needed to participate in the job application or interview process, to perform essential job functions, and/or to receive other benefits and privileges of employment, please contact MyHR@glic.com . Please note: this resource is for accommodation requests only. For all other inquires related to your application and careers at Guardian, refer to the Guardian Careers site. Visa Sponsorship Guardian is not currently or in the foreseeable future sponsoring employment visas.  In order to be a successful applicant. you must be legally authorized to work in the United States, without the need for employer sponsorship. Notice Regarding Guardian’s Use of Artificial Intelligence in Recruitment As part of Guardian’s job application process, Guardian may use artificial intelligence tools (“AI Tools"") to automate the sorting and filtering of information provided by applicants as part of its preliminary screening. This preliminary screening may be used to help identify applicant materials and resumes relative to their indication that the applicant meets the requirements for the specific job for which they are applying, as specified in the listing posted on Guardian’s jobs website (Careers at Guardian at https://www.guardianlife.com/careers ). At Guardian, we do not use AI Tools to substantially assist or replace human judgment or discretionary decision making in our hiring process. All hiring decisions will be made by Guardian colleagues. Please be aware that if you apply for a specific position with Guardian, you will have the choice of opting out of Guardian’s use of AI Tools during the job application process. If you would like to request an alternative process that does not utilize AI Tools or would like to request a reasonable accommodation, within ten business days of your position application, you must email your request to MyHR@glic.com , making sure to provide your name and job requisition identification number. Guardian will retain your applicant materials and resume and all information therefrom in accordance with Guardian’s document retention policy, a copy of which you may request via MyHR@glic.com . Additionally, at applicable times, Guardian will make public the most recent bias audit results for such AI tools, which may be found here . Current Guardian Colleagues: Please apply through the internal Jobs Hub in Workday.",New York,,2026-05-20,R000109389,Hybrid - In office 3 days per week,https://guardianlife.wd5.myworkdayjobs.com/Guardian-Life-Careers/job/New-York/Executive-Assistant--FPRS_R000109389
2026-06-29,"Senior Manager, External Communications – Consumer Markets","As a Senior Manager, External Communications – Financial Protection and Wealth Management , you will enhanc e and strengthen Guardian’s external reputation in protection, retirement, and wealth management . To do so, you will draw from your entrepreneurial mindset to scale a dedicated External Communications program focused on these topics, leveraging Guardian’s thought leadership, data, news, and initiatives to ensure consistent visibility in high-impact channels. You will partner closely with the broader External Communications team , as well as with Marketing, Brand, Social, and Enterprise Content colleagues, to ensure alignment across all of Guardian’s efforts . You will champion modern communications strategies, leveraging emerging technologies—including AI—to keep Guardian ahead in a rapidly evolving landscape. You are: A strategic communicator and influencer, experienced in leading external communications and PR campaigns Proactive and confident, thriving in a fast-paced environment while managing multiple priorities A trusted advisor who balances consultation with decisive recommendations Data-driven and insight-oriented, using analytics to refine strategies and measure impact Curios and adaptive, embracing AI and emerging media trends to shape innovative PR strategies and You have: 6-8 years of relevant experience in external communications and PR, ideally in financial services Proven ability to manage complex stakeholder relationships Exceptional writing and storytelling skills across multiple formats and channels A familiarity with various external communications and marketing amplification platforms Industry knowledge in wealth management, personal finance, retirement, and insurance You will: Turn subject matter expertise , research, and data into compelling external communications campaigns and initiatives across channels, positioning Guardian as a recognized and trusted expert among financial advisors and consumers. Help shape Guardian’s wealth thought leadership strategy , lead ing execution across channels in order to driv e visibility and awareness of Guardian’s products, solutions, and key business leaders . Assist in the development and coordination of relevant communication campaigns, including press releases, pitches, byline writing, briefing documents, talking points, key messages, social posts, newsletter development, and reporting, working collaboratively with agency and internal partners. Serve as liaison to reporters on media relations supporting the businesses. Build and strengthen key reporter relationships, staying current on relevant news outlets, industry coverage, and trends. Be the point person for media monitoring, including maintaining media coverage tracker and managing media relations inbox. Define KPIs and report on program effectiveness. Support all other responsibilities as defined by the team. Reporting relationships: You will report to the External Communications Lead, Group Benefits, Client Solutions and Wealth Management , and Financial Protection and Retirement Solutions Location: This role is based in our Hudson Yards, NY office with 3 days in office and 2 days WFH Salary Range: $103,450.00 - $169,960.00 The salary range reflected above is a good faith estimate of base pay for the primary location of the position. The salary for this position ultimately will be determined based on the education, experience, knowledge, and abilities of the successful candidate. In addition to salary, this role may also be eligible for annual, sales, or other incentive compensation. Our Promise At Guardian, you’ll have the support and flexibility to achieve your professional and personal goals.  Through skill-building, leadership development and philanthropic opportunities, we provide opportunities to build communities and grow your career, surrounded by diverse colleagues with high ethical standards. Inspire Well-Being As part of Guardian’s Purpose – to inspire well-being – we are committed to offering contemporary, supportive, flexible, and inclusive benefits and resources to our colleagues. Explore our company benefits at www.guardianlife.com/careers/corporate/benefits . Benefits apply to full-time eligible employees. Interns are not eligible for most Company benefits. Equal Employment Opportunity Guardian is an equal opportunity employer. All qualified applicants will be considered for employment without regard to age, race, color, creed, religion, sex, affectional or sexual orientation, national origin, ancestry, marital status, disability, military or veteran status, or any other classification protected by applicable law. Accommodations Guardian is committed to providing access, equal opportunity and reasonable accommodation for individuals with disabilities in employment, its services, programs, and activities. Guardian also provides reasonable accommodations to qualified job applicants (and employees) to accommodate the individual's known limitations related to pregnancy, childbirth, or related medical conditions, unless doing so would create an undue hardship. If reasonable accommodation is needed to participate in the job application or interview process, to perform essential job functions, and/or to receive other benefits and privileges of employment, please contact MyHR@glic.com . Please note: this resource is for accommodation requests only. For all other inquires related to your application and careers at Guardian, refer to the Guardian Careers site. Visa Sponsorship Guardian is not currently or in the foreseeable future sponsoring employment visas.  In order to be a successful applicant. you must be legally authorized to work in the United States, without the need for employer sponsorship. Notice Regarding Guardian’s Use of Artificial Intelligence in Recruitment As part of Guardian’s job application process, Guardian may use artificial intelligence tools (“AI Tools"") to automate the sorting and filtering of information provided by applicants as part of its preliminary screening. This preliminary screening may be used to help identify applicant materials and resumes relative to their indication that the applicant meets the requirements for the specific job for which they are applying, as specified in the listing posted on Guardian’s jobs website (Careers at Guardian at https://www.guardianlife.com/careers ). At Guardian, we do not use AI Tools to substantially assist or replace human judgment or discretionary decision making in our hiring process. All hiring decisions will be made by Guardian colleagues. Please be aware that if you apply for a specific position with Guardian, you will have the choice of opting out of Guardian’s use of AI Tools during the job application process. If you would like to request an alternative process that does not utilize AI Tools or would like to request a reasonable accommodation, within ten business days of your position application, you must email your request to MyHR@glic.com , making sure to provide your name and job requisition identification number. Guardian will retain your applicant materials and resume and all information therefrom in accordance with Guardian’s document retention policy, a copy of which you may request via MyHR@glic.com . Additionally, at applicable times, Guardian will make public the most recent bias audit results for such AI tools, which may be found here . Current Guardian Colleagues: Please apply through the internal Jobs Hub in Workday.",New York,,2026-05-20,R000108193,Hybrid - In office 3 days per week,https://guardianlife.wd5.myworkdayjobs.com/Guardian-Life-Careers/job/New-York/Senior-Manager--External-Communications---Consumer-Markets_R000108193
2026-06-29,"Head of Enterprise Data, Solutions & Operations","Head of Enterprise Data, Solutions & Operations Head of Enterprise Data, Solutions & Operations (Level 10) Role Summary The Head of Enterprise Data, Solutions & Operations is accountable for defining and leading Guardian’s enterprise data strategy, engineering execution, and operational delivery across all lines of business. This role owns the end-to-end data ecosystem—including data platforms, data engineering, data products, and data/ML operations—ensuring . scalable, reliable, and governed data capabilities that enable business performance and AI-driven outcomes. This leader establishes how data is built, managed, and operated across the enterprise, setting standards for engineering, platform integration, and operational excellence. The role ensures data is delivered as reusable, enterprise assets aligned to business priorities and technology strategy. Operating at the intersection of business and technology, this role partners with senior executives across Product, Architecture, and Value Streams to shape demand, prioritize investment, and deliver measurable outcomes. The Head of Enterprise Data, Solutions & Operations drives consistency, scalability, and accountability across a highly matrixed organization. You Will Enterprise Data Strategy & Ownership Define and own the enterprise data strategy across platforms, engineering, and data products Establish standards for how data is structured, built, governed, and scaled Drive the transition from fragmented, LOB-specific environments to a unified enterprise data ecosystem Enable advanced analytics, AI/GenAI, and cross-value stream insights Data Engineering & Platform Leadership Lead enterprise data engineering, including pipelines, integrations, and platform capabilities Oversee development of scalable, cloud-based data platforms Ensure consistent engineering standards, performance, and reliability Partner with Architecture to align to enterprise technology direction Data Operations & Reliability Own DataOps and MLOps, including reliability, observability, and incident management Establish operational standards for data availability, integrity, and performance Drive proactive monitoring and resolution of enterprise data issues Operating Model & Execution Define and lead how data capabilities are prioritized, funded, and delivered Drive alignment across Product, Engineering, Architecture, and Data teams Enable a federated model through centralized standards and distributed execution Business Alignment & Value Realization Translate business strategy into scalable data and platform capabilities Ensure data investments drive measurable outcomes (growth, efficiency, risk) Drive adoption and track performance and ROI of data and AI initiatives Leadership & Organizational Development Lead and scale teams across data engineering, platforms, and operations Build strong leadership bench and clear accountability structures Attract and retain top data and engineering talent Governance, Risk & Compliance Ensure alignment with data governance, security, and regulatory standards Oversee enterprise data risk, including quality issues and SLA performance You Are An enterprise leader in data, engineering, and operations Strong at influencing senior stakeholders and driving alignment Experienced in scaling capabilities in complex, matrixed environments Able to translate strategy into execution and measurable outcomes You Have 15+ years of experience in data, engineering, or technology leadership Proven experience leading enterprise data platforms, engineering, and operations Experience building and managing large, cross-functional teams Strong understanding of cloud, data platforms, APIs, and AI ecosystems Experience with DataOps/MLOps and federated delivery models Strong executive presence and stakeholder management skills Location Flexible: New York City preferred; Bethlehem, PA; Holmdel, NJ also options Occasional travel required Salary Range: $284,200 - $388,450 ​ The salary range reflected above is a good faith estimate of base pay for the primary location of the position. The salary for this position ultimately will be determined based on the education, experience, knowledge, and abilities of the successful candidate. In addition to salary, this role may also be eligible for annual, sales, or other incentive compensation. Our Promise At Guardian, you’ll have the support and flexibility to achieve your professional and personal goals.  Through skill-building, leadership development and philanthropic opportunities, we provide opportunities to build communities and grow your career, surrounded by diverse colleagues with high ethical standards. Inspire Well-Being As part of Guardian’s Purpose – to inspire well-being – we are committed to offering contemporary, supportive, flexible, and inclusive benefits and resources to our colleagues. Explore our company benefits at www.guardianlife.com/careers/corporate/benefits . Benefits apply to full-time eligible employees. Interns are not eligible for most Company benefits. Equal Employment Opportunity Guardian is an equal opportunity employer. All qualified applicants will be considered for employment without regard to age, race, color, creed, religion, sex, affectional or sexual orientation, national origin, ancestry, marital status, disability, military or veteran status, or any other classification protected by applicable law. Accommodations Guardian is committed to providing access, equal opportunity and reasonable accommodation for individuals with disabilities in employment, its services, programs, and activities. Guardian also provides reasonable accommodations to qualified job applicants (and employees) to accommodate the individual's known limitations related to pregnancy, childbirth, or related medical conditions, unless doing so would create an undue hardship. If reasonable accommodation is needed to participate in the job application or interview process, to perform essential job functions, and/or to receive other benefits and privileges of employment, please contact MyHR@glic.com . Please note: this resource is for accommodation requests only. For all other inquires related to your application and careers at Guardian, refer to the Guardian Careers site. Visa Sponsorship Guardian is not currently or in the foreseeable future sponsoring employment visas.  In order to be a successful applicant. you must be legally authorized to work in the United States, without the need for employer sponsorship. Notice Regarding Guardian’s Use of Artificial Intelligence in Recruitment As part of Guardian’s job application process, Guardian may use artificial intelligence tools (“AI Tools"") to automate the sorting and filtering of information provided by applicants as part of its preliminary screening. This preliminary screening may be used to help identify applicant materials and resumes relative to their indication that the applicant meets the requirements for the specific job for which they are applying, as specified in the listing posted on Guardian’s jobs website (Careers at Guardian at https://www.guardianlife.com/careers ). At Guardian, we do not use AI Tools to substantially assist or replace human judgment or discretionary decision making in our hiring process. All hiring decisions will be made by Guardian colleagues. Please be aware that if you apply for a specific position with Guardian, you will have the choice of opting out of Guardian’s use of AI Tools during the job application process. If you would like to request an alternative process that does not utilize AI Tools or would like to request a reasonable accommodation, within ten business days of your position application, you must email your request to MyHR@glic.com , making sure to provide your name and job requisition identification number. Guardian will retain your applicant materials and resume and all information therefrom in accordance with Guardian’s document retention policy, a copy of which you may request via MyHR@glic.com . Additionally, at applicable times, Guardian will make public the most recent bias audit results for such AI tools, which may be found here . Current Guardian Colleagues: Please apply through the internal Jobs Hub in Workday.",New York,,2026-05-20,R000109102,Hybrid - In office 3 days per week,https://guardianlife.wd5.myworkdayjobs.com/Guardian-Life-Careers/job/New-York/Head-of-Enterprise-Data--Solutions---Operations_R000109102
