Scraped Date,Job Title,Job Description,Location,Additional Locations,Posted Date,Job ID,Remote Type,Application URL
2026-06-29,Senior Colleague Relations Specialist,"Is the opportunity to join a culture where “We Do the Right Thing,” and “We Courageously Shape Our Future Together” important to you? If so, Guardian is seeking a motivated individual to join our team as a Senior Colleague Relations Specialist. This is an individual contributor who serves as a trusted advisor to People Leaders, Talent & Culture partners, and business stakeholders on complex colleague relations matters. This role leads high-impact casework, conducts sensitive and objective investigations, provides guidance on performance and conduct matters, interprets policy and employment-related requirements, and helps mitigate organizational risk while supporting a fair and respectful colleague experience. Operating with significant autonomy, this position also identifies trends, recommends proactive solutions, and helps strengthen colleague relations practices, manager capability, and organizational effectiveness. You will Serve as a trusted advisor to People Leaders, Talent & Culture partners, and business stakeholders on complex colleague relations matters, balancing colleague experience, business needs, and risk mitigation. Lead end-to-end, objective, and well-documented investigations involving allegations of misconduct, harassment, discrimination, retaliation, policy violations, and other sensitive workplace concerns. Provide consultative guidance and coaching to managers on performance management, corrective action, workplace behavior, terminations, and other colleague-related decisions to promote fairness, consistency, and compliance. Interpret and apply company policy, employment-related requirements, and internal practices to complex situations, recommending practical and defensible solutions. Partner closely with Legal, Compliance, Talent & Culture, and business leadership to assess risk, align on approach, and resolve colleague relations issues effectively and timely. Identify patterns and trends across colleague relations cases, leader inquiries, and workplace concerns; use insights to recommend proactive actions, manager education, and process or policy enhancements. Support the development, review, and continuous improvement of colleague relations policies, processes, practices, and guidance to drive consistency and a contemporary colleague experience. Develop and deliver training, tools, and practical guidance for managers and Talent & Culture partners on topics such as workplace conduct, policy application, documentation, and performance management. Act as a mentor and resource to peers and partners by sharing subject matter expertise, elevating case management practices, and helping build organizational capability in colleague relations. Leverage HR technology and AI-enabled tools responsibly to support case intake, documentation, trend analysis, and process efficiency, while maintaining human judgment, data privacy, confidentiality, and appropriate governance. Maintain accurate, timely, and confidential records, investigation materials, and case documentation, and prepare clear summaries and recommendations suitable for leadership and legal review. You have Bachelor’s degree in Human Resources, Business Administration, or a related field, or equivalent professional experience. 5+ years of progressive experience in colleague relations, employee relations, HR, employment practices, or a related field, including experience managing complex and sensitive matters independently. Specialized depth of expertise in colleague relations, including investigations, performance management, policy interpretation, corrective action, and workplace risk mitigation. Strong working knowledge of employment laws, regulations, and HR best practices, including EEO, anti-discrimination, anti-harassment, retaliation, and related workplace requirements. Demonstrated ability to conduct thorough, objective, and well-reasoned investigations, assess credibility, synthesize facts, and prepare clear written findings and recommendations. Strong judgment and problem-solving skills, with the ability to navigate ambiguity, analyze risk, and recommend practical solutions in complex situations. Excellent interpersonal, consulting, and communication skills, with the ability to influence, coach, and adapt style effectively when working with colleagues and leaders at all levels. Ability to build trust and credibility while managing highly sensitive information with discretion, sound judgment, and a high degree of confidentiality. Experience identifying themes and trends in colleague relations data and translating insights into recommendations for policy, process, training, or leader capability improvements. Proficiency with HR systems and Microsoft Office tools; comfort using AI-enabled tools and digital technologies to improve workflow efficiency, reporting, and knowledge management in a responsible and compliant manner. Location /Travel Hybrid role –in office 3 days a week, Hudson Yards, NYC, Bethlehem, PA, or Holmdel NJ. 2 days WFH. Salary Range: $103,450.00 - $169,960.00 The salary range reflected above is a good faith estimate of base pay for the primary location of the position. The salary for this position ultimately will be determined based on the education, experience, knowledge, and abilities of the successful candidate. In addition to salary, this role may also be eligible for annual, sales, or other incentive compensation. Our Promise At Guardian, you’ll have the support and flexibility to achieve your professional and personal goals.  Through skill-building, leadership development and philanthropic opportunities, we provide opportunities to build communities and grow your career, surrounded by diverse colleagues with high ethical standards. Inspire Well-Being As part of Guardian’s Purpose – to inspire well-being – we are committed to offering contemporary, supportive, flexible, and inclusive benefits and resources to our colleagues. Explore our company benefits at www.guardianlife.com/careers/corporate/benefits . Benefits apply to full-time eligible employees. Interns are not eligible for most Company benefits. Equal Employment Opportunity Guardian is an equal opportunity employer. All qualified applicants will be considered for employment without regard to age, race, color, creed, religion, sex, affectional or sexual orientation, national origin, ancestry, marital status, disability, military or veteran status, or any other classification protected by applicable law. Accommodations Guardian is committed to providing access, equal opportunity and reasonable accommodation for individuals with disabilities in employment, its services, programs, and activities. Guardian also provides reasonable accommodations to qualified job applicants (and employees) to accommodate the individual's known limitations related to pregnancy, childbirth, or related medical conditions, unless doing so would create an undue hardship. If reasonable accommodation is needed to participate in the job application or interview process, to perform essential job functions, and/or to receive other benefits and privileges of employment, please contact MyHR@glic.com . Please note: this resource is for accommodation requests only. For all other inquires related to your application and careers at Guardian, refer to the Guardian Careers site. Visa Sponsorship Guardian is not currently or in the foreseeable future sponsoring employment visas.  In order to be a successful applicant. you must be legally authorized to work in the United States, without the need for employer sponsorship. Notice Regarding Guardian’s Use of Artificial Intelligence in Recruitment As part of Guardian’s job application process, Guardian may use artificial intelligence tools (“AI Tools"") to automate the sorting and filtering of information provided by applicants as part of its preliminary screening. This preliminary screening may be used to help identify applicant materials and resumes relative to their indication that the applicant meets the requirements for the specific job for which they are applying, as specified in the listing posted on Guardian’s jobs website (Careers at Guardian at https://www.guardianlife.com/careers ). At Guardian, we do not use AI Tools to substantially assist or replace human judgment or discretionary decision making in our hiring process. All hiring decisions will be made by Guardian colleagues. Please be aware that if you apply for a specific position with Guardian, you will have the choice of opting out of Guardian’s use of AI Tools during the job application process. If you would like to request an alternative process that does not utilize AI Tools or would like to request a reasonable accommodation, within ten business days of your position application, you must email your request to MyHR@glic.com , making sure to provide your name and job requisition identification number. Guardian will retain your applicant materials and resume and all information therefrom in accordance with Guardian’s document retention policy, a copy of which you may request via MyHR@glic.com . Additionally, at applicable times, Guardian will make public the most recent bias audit results for such AI tools, which may be found here . Current Guardian Colleagues: Please apply through the internal Jobs Hub in Workday.",New York,"Bethlehem, Holmdel",2026-06-04,R000109475,Hybrid - In office 3 days per week,https://guardianlife.wd5.myworkdayjobs.com/Guardian-Life-Careers/job/New-York/Senior-Colleague-Relations-Specialist_R000109475
2026-06-29,Lead Software Engineer,"As a Tech Lead, you’ll serve as the hands-on technical leader for a team within Guardian’s Digital & Technology organization. You’ll guide engineers in building secure, scalable, and high-performing solutions, while ensuring engineering practices align to Guardian’s architectural and delivery standards. Working closely with the Product D&T Leader and Product Owner, you’ll translate business outcomes into technical execution and foster a culture of engineering excellence You Are A self-starter, continuous learner and hands-on technical engineer who can translate vision from the Platform / Product D&T leader into development by partnering across the engineers, product managers, business partners and executive stakeholders. You Will Lead and mentor a team of software engineers, fostering a collaborative and high-performing environment. Architect, design, and develop robust, scalable, and secure software applications using modern engineering practices. Oversee the entire software development lifecycle, from requirements gathering and design to deployment and maintenance. Design and implement Microservices Architecture to create highly modular and maintainable systems. Utilize Cloud Computing platforms to build and deploy scalable and resilient applications. Design, develop, and deploy high-volume, high-usage eSuite portals and APIs, utilizing React, Next.js. Conduct thorough Debugging and Software Testing to identify and resolve issues efficiently. Manage code repositories and collaborate effectively using Version Control Systems. Integrate various systems and platforms through Web Services Integration. Demonstrate strong Analytical Acumen to solve complex technical challenges. You Have : Minimum of 10 years of experience in software development, with at least 3 years in a lead or senior engineering role. 3-5 years of experience successfully developing APIs using C#, .NET Core, and building modern web applications using React and Next.js. Strong .NET & C# expertise on backend services with async programming and memory management. Strong proficiency in front-end development with React, Next.js, JavaScript, HTML5, and responsive CSS Experienced in object-oriented programming and design patterns. Experience building responsive, cross-browser compatible user interfaces. 5+ years working with Web API (.NET core), REST Services, WCF or SOAP Services. Experience developing and maintaining front-end applications using React and/or Next.js. 5+ years of experience in database principles, such as SQL Working experience with Splunk (logging), AppDynamics, JSON/XML, Caching, Performance Analysis & Profiling, Experience resolving code smells, vulnerabilities, and application security flaws. Experience with source code repositories tools, BitBucket, GitHub. Professional experience with CI/CD pipelines, Aws, ECS, Docker and EKS Ability to interact and communicate successfully with business partners and technology teams. Strong knowledge of release/build/configuration management practices. Strong understanding of software best-practices as it applies to web and business application development with hands on architecture design and development experience required in building APIs and front-end applications for large scale platforms. Demonstrable understanding of object-oriented design/development, functional programming, service-oriented architecture, and modern front-end frameworks. Ability to prioritize and manage work, adhering to critical and aggressive project timelines in a fast-paced environment. Extensive experience in Software Development Life Cycle Management using Kanban, Scrum, or Scaled Agile is required. Experience working in a rapid and agile development environment with frequent deliveries. Passion for building seamless user experiences and collaborating across the stack. Location: Hybrid 3 days in Bethlehem, PA or Holmdel, NJ Salary Range: $99,150.00 - $162,885.00 The salary range reflected above is a good faith estimate of base pay for the primary location of the position. The salary for this position ultimately will be determined based on the education, experience, knowledge, and abilities of the successful candidate. In addition to salary, this role may also be eligible for annual, sales, or other incentive compensation. Our Promise At Guardian, you’ll have the support and flexibility to achieve your professional and personal goals.  Through skill-building, leadership development and philanthropic opportunities, we provide opportunities to build communities and grow your career, surrounded by diverse colleagues with high ethical standards. Inspire Well-Being As part of Guardian’s Purpose – to inspire well-being – we are committed to offering contemporary, supportive, flexible, and inclusive benefits and resources to our colleagues. Explore our company benefits at www.guardianlife.com/careers/corporate/benefits . Benefits apply to full-time eligible employees. Interns are not eligible for most Company benefits. Equal Employment Opportunity Guardian is an equal opportunity employer. All qualified applicants will be considered for employment without regard to age, race, color, creed, religion, sex, affectional or sexual orientation, national origin, ancestry, marital status, disability, military or veteran status, or any other classification protected by applicable law. Accommodations Guardian is committed to providing access, equal opportunity and reasonable accommodation for individuals with disabilities in employment, its services, programs, and activities. Guardian also provides reasonable accommodations to qualified job applicants (and employees) to accommodate the individual's known limitations related to pregnancy, childbirth, or related medical conditions, unless doing so would create an undue hardship. If reasonable accommodation is needed to participate in the job application or interview process, to perform essential job functions, and/or to receive other benefits and privileges of employment, please contact MyHR@glic.com . Please note: this resource is for accommodation requests only. For all other inquires related to your application and careers at Guardian, refer to the Guardian Careers site. Visa Sponsorship Guardian is not currently or in the foreseeable future sponsoring employment visas.  In order to be a successful applicant. you must be legally authorized to work in the United States, without the need for employer sponsorship. Notice Regarding Guardian’s Use of Artificial Intelligence in Recruitment As part of Guardian’s job application process, Guardian may use artificial intelligence tools (“AI Tools"") to automate the sorting and filtering of information provided by applicants as part of its preliminary screening. This preliminary screening may be used to help identify applicant materials and resumes relative to their indication that the applicant meets the requirements for the specific job for which they are applying, as specified in the listing posted on Guardian’s jobs website (Careers at Guardian at https://www.guardianlife.com/careers ). At Guardian, we do not use AI Tools to substantially assist or replace human judgment or discretionary decision making in our hiring process. All hiring decisions will be made by Guardian colleagues. Please be aware that if you apply for a specific position with Guardian, you will have the choice of opting out of Guardian’s use of AI Tools during the job application process. If you would like to request an alternative process that does not utilize AI Tools or would like to request a reasonable accommodation, within ten business days of your position application, you must email your request to MyHR@glic.com , making sure to provide your name and job requisition identification number. Guardian will retain your applicant materials and resume and all information therefrom in accordance with Guardian’s document retention policy, a copy of which you may request via MyHR@glic.com . Additionally, at applicable times, Guardian will make public the most recent bias audit results for such AI tools, which may be found here . Current Guardian Colleagues: Please apply through the internal Jobs Hub in Workday.",Bethlehem,Holmdel,2026-06-04,R000109079,Hybrid - In office 3 days per week,https://guardianlife.wd5.myworkdayjobs.com/Guardian-Life-Careers/job/Bethlehem/Technical-Product-Owner--Engineer_R000109079
2026-06-29,Business Analyst III,"Job Purpose The Business Analyst partners with business and technology stakeholders to identify, analyze, and document business needs, ensuring the delivery of effective, compliant, and scalable system solutions. This role focuses on translating business requirements into clear functional specifications while supporting process improvement initiatives and system enhancements that align with Guardian’s enterprise objectives. Key Responsibilities Partner with business stakeholders to elicit, analyze, and document business and functional requirements that support strategic and operational goals. Contribute to the design and improvement of business processes and procedures to enhance efficiency, accuracy, and user experience. Business and functional requirements documents Develop and maintain comprehensive requirements and analysis artifacts, including: Process flows and workflow diagrams Use cases, business rules, and supporting specifications System access matrices, configuration documentation, and setup data Support solution delivery by defining test scope, developing test scenarios, and participating in system and user acceptance testing. Serve as a liaison between business partners and technology teams to ensure shared understanding of business processes, priorities, and requirements. Participate in reviews of team deliverables to ensure quality, consistency, and adherence to Guardian documentation standards. Communicate analysis findings and recommendations through clear, concise presentations and decision‑support materials. Work independently on moderately complex initiatives and contribute to or lead defined components of larger or more complex projects. Business Analysis Job Family Overview Acts as a representative of the business in system design, enhancement, and implementation efforts. Partners with technology and systems teams to ensure solutions meet business needs and integrate effectively with existing platforms. Focuses primarily on business process, requirements definition, and functional understanding rather than technical design or programming. Requires working knowledge of supported systems and how they interface with related enterprise systems. Level Profile Demonstrates in‑depth practical and conceptual knowledge within the Business Analysis discipline. Applies independent judgment and seasoned experience to solve complex business and system problems. Operates with broad direction and accountability, exercising autonomy in day‑to‑day responsibilities. Serves as a resource and informal mentor to colleagues with less experience. Represents a senior individual contributor role where professional growth may focus on deepening expertise and impact. 4–6+ years of relevant business analysis experience . Salary Range: $68,970.00 - $113,310.00 The salary range reflected above is a good faith estimate of base pay for the primary location of the position. The salary for this position ultimately will be determined based on the education, experience, knowledge, and abilities of the successful candidate. In addition to salary, this role may also be eligible for annual, sales, or other incentive compensation. Our Promise At Guardian, you’ll have the support and flexibility to achieve your professional and personal goals.  Through skill-building, leadership development and philanthropic opportunities, we provide opportunities to build communities and grow your career, surrounded by diverse colleagues with high ethical standards. Inspire Well-Being As part of Guardian’s Purpose – to inspire well-being – we are committed to offering contemporary, supportive, flexible, and inclusive benefits and resources to our colleagues. Explore our company benefits at www.guardianlife.com/careers/corporate/benefits . Benefits apply to full-time eligible employees. Interns are not eligible for most Company benefits. Equal Employment Opportunity Guardian is an equal opportunity employer. All qualified applicants will be considered for employment without regard to age, race, color, creed, religion, sex, affectional or sexual orientation, national origin, ancestry, marital status, disability, military or veteran status, or any other classification protected by applicable law. Accommodations Guardian is committed to providing access, equal opportunity and reasonable accommodation for individuals with disabilities in employment, its services, programs, and activities. Guardian also provides reasonable accommodations to qualified job applicants (and employees) to accommodate the individual's known limitations related to pregnancy, childbirth, or related medical conditions, unless doing so would create an undue hardship. If reasonable accommodation is needed to participate in the job application or interview process, to perform essential job functions, and/or to receive other benefits and privileges of employment, please contact MyHR@glic.com . Please note: this resource is for accommodation requests only. For all other inquires related to your application and careers at Guardian, refer to the Guardian Careers site. Visa Sponsorship Guardian is not currently or in the foreseeable future sponsoring employment visas.  In order to be a successful applicant. you must be legally authorized to work in the United States, without the need for employer sponsorship. Notice Regarding Guardian’s Use of Artificial Intelligence in Recruitment As part of Guardian’s job application process, Guardian may use artificial intelligence tools (“AI Tools"") to automate the sorting and filtering of information provided by applicants as part of its preliminary screening. This preliminary screening may be used to help identify applicant materials and resumes relative to their indication that the applicant meets the requirements for the specific job for which they are applying, as specified in the listing posted on Guardian’s jobs website (Careers at Guardian at https://www.guardianlife.com/careers ). At Guardian, we do not use AI Tools to substantially assist or replace human judgment or discretionary decision making in our hiring process. All hiring decisions will be made by Guardian colleagues. Please be aware that if you apply for a specific position with Guardian, you will have the choice of opting out of Guardian’s use of AI Tools during the job application process. If you would like to request an alternative process that does not utilize AI Tools or would like to request a reasonable accommodation, within ten business days of your position application, you must email your request to MyHR@glic.com , making sure to provide your name and job requisition identification number. Guardian will retain your applicant materials and resume and all information therefrom in accordance with Guardian’s document retention policy, a copy of which you may request via MyHR@glic.com . Additionally, at applicable times, Guardian will make public the most recent bias audit results for such AI tools, which may be found here . Current Guardian Colleagues: Please apply through the internal Jobs Hub in Workday.",Bethlehem,,2026-06-04,R000109317,Hybrid - In office 3 days per week,https://guardianlife.wd5.myworkdayjobs.com/Guardian-Life-Careers/job/Bethlehem/Business-Analyst-III_R000109317
