Scraped Date,Job Title,Job Description,Location,Additional Locations,Posted Date,Job ID,Remote Type,Application URL
2026-05-04,Technical Lead - Software Engineering,"Technical Lead Reports To: Value Stream D&T Leader Career Stage: Technical Leadership / Product-Level Engineering Lead Role Summary As a Tech Lead, you’ll serve as the hands-on technical leader for a product or platform within Guardian’s Digital & Technology organization. You’ll guide engineers in building secure, scalable, and high-performing solutions, while ensuring engineering practices align to Guardian’s architectural and delivery standards. Working closely with the Value Stream D&T Leader and Product Managers, you’ll translate business outcomes into technical execution and foster a culture of engineering excellence. You Will Lead the design, development, and technical delivery for one or more agile squads. Define and enforce coding standards, best practices, application support and test automation strategies. Manage all team level dependencies in partnership with Product Owner. Continuous look for opportunities to optimize the team Collaborate with Product and COEs, Data, AI, Architecture, and QA teams to ensure technical alignment. Conduct design and code reviews to maintain quality, scalability, support and security. Mentor engineers, fostering skill development and technical depth across the team. Troubleshoot complex issues and implement long-term, sustainable solutions. Drive adoption of SDLC practices CI/CD, and cloud-native solutions. Contribute to technical roadmaps, influencing architecture and modernization decisions. Write and deploy code or configuration to support the product teams You Have 9–12 years of software engineering experience, including several in a technical leadership role. Deep hands-on expertise in modern programming languages such asJava, Python, and Node.js, and modern frameworks. Strong understanding of AI, Data, APIs, microservices, and distributed systems. Experience working in cloud-based environments (AWS, Azure, or GCP). Demonstrated ability to mentor engineers and improve team performance. Excellent collaboration skills with cross-functional teams in agile settings. Location: Hybrid – Three days a week at a Guardian Location in New York, NY, Holmdel, NJ or Bethlehem, PA. Salary Range: $118,980.00 - $195,465.00 The salary range reflected above is a good faith estimate of base pay for the primary location of the position. The salary for this position ultimately will be determined based on the education, experience, knowledge, and abilities of the successful candidate. In addition to salary, this role may also be eligible for annual, sales, or other incentive compensation. Our Promise At Guardian, you’ll have the support and flexibility to achieve your professional and personal goals.  Through skill-building, leadership development and philanthropic opportunities, we provide opportunities to build communities and grow your career, surrounded by diverse colleagues with high ethical standards. Inspire Well-Being As part of Guardian’s Purpose – to inspire well-being – we are committed to offering contemporary, supportive, flexible, and inclusive benefits and resources to our colleagues. Explore our company benefits at www.guardianlife.com/careers/corporate/benefits . Benefits apply to full-time eligible employees. Interns are not eligible for most Company benefits. Equal Employment Opportunity Guardian is an equal opportunity employer. All qualified applicants will be considered for employment without regard to age, race, color, creed, religion, sex, affectional or sexual orientation, national origin, ancestry, marital status, disability, military or veteran status, or any other classification protected by applicable law. Accommodations Guardian is committed to providing access, equal opportunity and reasonable accommodation for individuals with disabilities in employment, its services, programs, and activities. Guardian also provides reasonable accommodations to qualified job applicants (and employees) to accommodate the individual's known limitations related to pregnancy, childbirth, or related medical conditions, unless doing so would create an undue hardship. If reasonable accommodation is needed to participate in the job application or interview process, to perform essential job functions, and/or to receive other benefits and privileges of employment, please contact MyHR@glic.com . Please note: this resource is for accommodation requests only. For all other inquires related to your application and careers at Guardian, refer to the Guardian Careers site. Visa Sponsorship Guardian is not currently or in the foreseeable future sponsoring employment visas.  In order to be a successful applicant. you must be legally authorized to work in the United States, without the need for employer sponsorship. Notice Regarding Guardian’s Use of Artificial Intelligence in Recruitment As part of Guardian’s job application process, Guardian may use artificial intelligence tools (“AI Tools) to automate the sorting and filtering of information provided by applicants as part of its preliminary screening. This preliminary screening may be used to help identify applicant materials and resumes relative to their indication that the applicant meets the requirements for the specific job for which they are applying, as specified in the listing posted on Guardian’s jobs website (Careers at Guardian at https://www.guardianlife.com/careers ). At Guardian, we do not use AI Tools to substantially assist or replace human judgment or discretionary decision making in our hiring process. All hiring decisions will be made by Guardian colleagues. Please be aware that if you apply for a specific position with Guardian, you will have the choice of opting out of Guardian’s use of AI Tools during the job application process. If you would like to request an alternative process that does not utilize AI Tools or would like to request a reasonable accommodation, within ten business days of your position application, you must email your request to MyHR@glic.com , making sure to provide your name and job requisition identification number. Guardian will retain your applicant materials and resume and all information therefrom in accordance with Guardian’s document retention policy, a copy of which you may request via MyHR@glic.com . Additionally, at applicable times, Guardian will make public the most recent bias audit results for such AI tools, which may be found here . Current Guardian Colleagues: Please apply through the internal Jobs Hub in Workday.",Holmdel,"Bethlehem, New York",2026-04-27,R000108288,Hybrid - In office 3 days per week,https://guardianlife.wd5.myworkdayjobs.com/Guardian-Life-Careers/job/Holmdel/Technical-Lead---Software-Engineering_R000108288
2026-05-04,Compensation Analyst,"Is the opportunity to join a culture where “We Do the Right Thing,” and “We Courageously Shape Our Future Together” important to you? If so, Guardian is seeking a motivated individual to join our team as a Compensation Analyst. This role supports the compensation function in the design, implementation, and ongoing management of compensation programs and initiatives. Partners with HR and business leaders to provide timely, accurate compensation analysis and guidance—ranging from job role definition and job grading/slotting to market pricing and offer support. Use analytical tools and spreadsheets to model alternatives, interpret policy guidelines, and explain compensation decisions to employees and leaders. Contributes to ad hoc projects to solve specific compensation problems, sometimes taking a lead analysis role. You are An analytical, service-oriented compensation professional who delivers efficient, timely, and responsive support to managers and HR partners. You are comfortable translating complex data into clear recommendations, proactively identifying needs, and knowing when to escalate out-of-guideline or higher-risk situations. You work effectively under indirect supervision, coordinate activities across stakeholders, and take initiative to suggest practical process improvements. You can resolve routine and non-routine issues quickly, while seeking guidance on the most complex matters. You have BA/BS degree, or an equivalent combination of training and experience. 2–4 years of related experience in compensation, HR analytics, or a closely related HR support function. Strong analytical and spreadsheet/modeling skills; able to develop alternative scenarios and interpret results. Solid written, verbal, and interpersonal communication skills, including explaining compensation outcomes to leaders and employees. Ability to work on assignments of moderate size/scope and coordinate work under indirect supervision. You will Provide operational compensation support to HR and leaders, including job role definitions, job grading/slotting, and interpretation of compensation policies and guidelines. Identify appropriate market peers and complete market pricing for single or multiple positions; summarize findings and recommendations clearly. Support job offer development (including pay recommendations) by analyzing internal equity, market data, and policy considerations. Develop alternative compensation scenarios using spreadsheets and other tools; evaluate tradeoffs and document assumptions. Explain compensation-related decisions and program mechanics to employees and groups, ensuring clarity and consistency. Participate in ad hoc compensation projects may lead analysis workstreams to solve specific problems and recommend process improvements. Reporting Relationships As our Compensation Analyst, you will report to our Head of Broad-Based Compensation/Head of Executive Compensation. Location /Travel Hybrid role: 3 days in the Stamford CT or Bethlehem PA office.  2 days WFH. Salary Range: $70,930.00 - $106,390.00 The salary range reflected above is a good faith estimate of base pay for the primary location of the position. The salary for this position ultimately will be determined based on the education, experience, knowledge, and abilities of the successful candidate. In addition to salary, this role may also be eligible for annual, sales, or other incentive compensation. Our Promise At Guardian, you’ll have the support and flexibility to achieve your professional and personal goals.  Through skill-building, leadership development and philanthropic opportunities, we provide opportunities to build communities and grow your career, surrounded by diverse colleagues with high ethical standards. Inspire Well-Being As part of Guardian’s Purpose – to inspire well-being – we are committed to offering contemporary, supportive, flexible, and inclusive benefits and resources to our colleagues. Explore our company benefits at www.guardianlife.com/careers/corporate/benefits . Benefits apply to full-time eligible employees. Interns are not eligible for most Company benefits. Equal Employment Opportunity Guardian is an equal opportunity employer. All qualified applicants will be considered for employment without regard to age, race, color, creed, religion, sex, affectional or sexual orientation, national origin, ancestry, marital status, disability, military or veteran status, or any other classification protected by applicable law. Accommodations Guardian is committed to providing access, equal opportunity and reasonable accommodation for individuals with disabilities in employment, its services, programs, and activities. Guardian also provides reasonable accommodations to qualified job applicants (and employees) to accommodate the individual's known limitations related to pregnancy, childbirth, or related medical conditions, unless doing so would create an undue hardship. If reasonable accommodation is needed to participate in the job application or interview process, to perform essential job functions, and/or to receive other benefits and privileges of employment, please contact MyHR@glic.com . Please note: this resource is for accommodation requests only. For all other inquires related to your application and careers at Guardian, refer to the Guardian Careers site. Visa Sponsorship Guardian is not currently or in the foreseeable future sponsoring employment visas.  In order to be a successful applicant. you must be legally authorized to work in the United States, without the need for employer sponsorship. Notice Regarding Guardian’s Use of Artificial Intelligence in Recruitment As part of Guardian’s job application process, Guardian may use artificial intelligence tools (“AI Tools) to automate the sorting and filtering of information provided by applicants as part of its preliminary screening. This preliminary screening may be used to help identify applicant materials and resumes relative to their indication that the applicant meets the requirements for the specific job for which they are applying, as specified in the listing posted on Guardian’s jobs website (Careers at Guardian at https://www.guardianlife.com/careers ). At Guardian, we do not use AI Tools to substantially assist or replace human judgment or discretionary decision making in our hiring process. All hiring decisions will be made by Guardian colleagues. Please be aware that if you apply for a specific position with Guardian, you will have the choice of opting out of Guardian’s use of AI Tools during the job application process. If you would like to request an alternative process that does not utilize AI Tools or would like to request a reasonable accommodation, within ten business days of your position application, you must email your request to MyHR@glic.com , making sure to provide your name and job requisition identification number. Guardian will retain your applicant materials and resume and all information therefrom in accordance with Guardian’s document retention policy, a copy of which you may request via MyHR@glic.com . Additionally, at applicable times, Guardian will make public the most recent bias audit results for such AI tools, which may be found here . Current Guardian Colleagues: Please apply through the internal Jobs Hub in Workday.",Stamford,Bethlehem,2026-04-24,R000109139,Hybrid - In office 3 days per week,https://guardianlife.wd5.myworkdayjobs.com/Guardian-Life-Careers/job/Stamford/Compensation-Analyst_R000109139-1
2026-05-04,Head of High Net Worth Sales,"The Head of High Net Worth (HNW) Sales bridges sales execution, portfolio construction, and strategic alternatives positioning, ensuring HNW advisors receive consistent guidance, scalable frameworks, and repeatable outcomes across both managed and brokerage platforms. You will Core Responsibilities (Revenue, Advisor Coverage, and Growth): Business Development & Advisor Engagement Drive new and existing advisor growth through sales presentations, discovery, and solutioning tied to production goals. Managed account proposals: position model/strategy fit, overcome objections, and convert proposals into funded assets. Alternative investments: increase advisor adoption and client allocations through education, case sourcing, and follow-through to close. Structured notes: position as return-seeking and risk-managed solutions, partnering with advisors to source opportunities and execute trades. Lending: originate and grow lending penetration as a core driver of client acquisition, wallet-share expansion, and retention. Translate complex strategies into advisor- and client-ready sales narratives that support portfolio construction goals and accelerate close rates. Sales Team Leadership, Specialist Enablement & Campaign Execution Partner with the Head of Wealth Specialists, setting coverage priorities, activity standards, and consistent commercial messaging across regions. Design and execute thematic sales campaigns that generate qualified opportunities and drive measurable asset flows, including: Product-led campaigns (new launches, cross-sell, and adoption) Market-led campaigns (rate/volatility themes, repositioning, and risk conversations) Allocation-led campaigns (model shifts, sleeve funding, and rebalance opportunities) Own reporting cadence for pod activity and outcomes (meetings, pipeline, conversions, asset flows, and lending/notes adoption) and use insights to refine future campaign rollouts. Advisor Coverage Model & Travel (Territory Growth) Execute a high-touch coverage model through in-person travel and virtual engagement to grow production, deepen relationships, and move opportunities to close, prioritizing: High‑impact opportunities Complex cases Strategic HNW relationships Proactive book-of-business reviews to identify segmented client opportunities beyond formal campaigns Large Case Pipeline, Governance & Cross-Functional Deal Management Own the large-case intake and governance process, ensuring cases are properly qualified, submitted, and advanced through internal review to support advisor conversion. Submit cases to the Portfolio Review team for formal analysis with clear objectives, competitive context, and next-step recommendations. Run a standardized review process that improves cycle time and win rates, including: Pre‑review submission criteria Post‑review follow‑up calls Documented advisor meetings and outcomes Track review activity, next steps, and outcomes to drive accountability, repeatability, and improved close rates. Coordinate large-case collaboration with LBS, Advanced Markets, and other partners to assemble case design teams and remove execution friction. Alternatives Growth Strategy (“Alts Sleeve”) & Adoption Partner with internal teams to build and scale a holistic “Alternatives Sleeve” framework that increases advisor adoption and client allocations. Position alternatives as repeatable, intentional portfolio components (not one-off trades), leveraging enterprise capabilities and strategic partners to drive scalable sales outcomes. Structured Notes: Sales Integration Within the Alts Allocation Integrate structured notes into the alternatives allocation framework and drive consistent advisor usage through targeted education and case-by-case execution support. Frame structured notes within a cohesive allocation story alongside private markets, reinforcing when/why to use them and improving conversion in client conversations. Lending: Go-to-Market Strategy & Origination Growth Assess the current lending landscape and partner with Product to build and execute a plan that increases penetration, improves referral-to-close process, and scales lending across HNW opportunities. OCIO/HNW Platform: Build, Launch & Drive Adoption Partner with Product to assess the current landscape and select/build an OCIO/HNW platform that enables scalable sales across advisory, lending, and alternatives. Launch the platform in Park Avenue, train advisors on use cases and positioning, and drive measurable adoption through targeted prospecting and case execution. Go-to-Market Leadership (Marketing + Product) & Sales Performance Management Lead execution of agreed go-to-market plans with Product and Marketing, ensuring advisor readiness, field enablement, and coordinated sales motions. Own KPI definition and reporting (pipeline, asset flows, adoption, and revenue where applicable), maintain a forecast cadence, and communicate progress and gaps to senior leadership. You have Senior-level experience partnering directly with top financial advisors on complex sales efforts. Approximately 8–10 years of professional experience, including demonstrated success in territory management and building product sales within a defined market. Strong ability to work cross-functionally with marketing, product, and sales teams, influencing outcomes and directing work without having formal people management responsibility. Comfort presenting to senior leadership, developing and managing key performance indicators, and operating in a role with compensation tied directly to sales performance. Willingness to be New York–based with significant travel expectations, spending the majority of time either in market with advisors or in the office as required. Understanding of insurance distribution is preferred, along with experience collaborating closely with internal sales leadership and product partners. Securities licenses such as Series 7, 63, and 65 are preferred but not mandatory; additional credentials like the CIMA designation are considered a strong plus. Location & Travel Hudson Yards NYC - Hybrid Role - Three days in office when not traveling. Significant travel required to meet with Advisors in the field. Our Promise At Guardian, you’ll have the support and flexibility to achieve your professional and personal goals.  Through skill-building, leadership development and philanthropic opportunities, we provide opportunities to build communities and grow your career, surrounded by diverse colleagues with high ethical standards. Inspire Well-Being As part of Guardian’s Purpose – to inspire well-being – we are committed to offering contemporary, supportive, flexible, and inclusive benefits and resources to our colleagues. Explore our company benefits at www.guardianlife.com/careers/corporate/benefits . Benefits apply to full-time eligible employees. Interns are not eligible for most Company benefits. Equal Employment Opportunity Guardian is an equal opportunity employer. All qualified applicants will be considered for employment without regard to age, race, color, creed, religion, sex, affectional or sexual orientation, national origin, ancestry, marital status, disability, military or veteran status, or any other classification protected by applicable law. Accommodations Guardian is committed to providing access, equal opportunity and reasonable accommodation for individuals with disabilities in employment, its services, programs, and activities. Guardian also provides reasonable accommodations to qualified job applicants (and employees) to accommodate the individual's known limitations related to pregnancy, childbirth, or related medical conditions, unless doing so would create an undue hardship. If reasonable accommodation is needed to participate in the job application or interview process, to perform essential job functions, and/or to receive other benefits and privileges of employment, please contact MyHR@glic.com . Please note: this resource is for accommodation requests only. For all other inquires related to your application and careers at Guardian, refer to the Guardian Careers site. Visa Sponsorship Guardian is not currently or in the foreseeable future sponsoring employment visas.  In order to be a successful applicant. you must be legally authorized to work in the United States, without the need for employer sponsorship. Notice Regarding Guardian’s Use of Artificial Intelligence in Recruitment As part of Guardian’s job application process, Guardian may use artificial intelligence tools (“AI Tools) to automate the sorting and filtering of information provided by applicants as part of its preliminary screening. This preliminary screening may be used to help identify applicant materials and resumes relative to their indication that the applicant meets the requirements for the specific job for which they are applying, as specified in the listing posted on Guardian’s jobs website (Careers at Guardian at https://www.guardianlife.com/careers ). At Guardian, we do not use AI Tools to substantially assist or replace human judgment or discretionary decision making in our hiring process. All hiring decisions will be made by Guardian colleagues. Please be aware that if you apply for a specific position with Guardian, you will have the choice of opting out of Guardian’s use of AI Tools during the job application process. If you would like to request an alternative process that does not utilize AI Tools or would like to request a reasonable accommodation, within ten business days of your position application, you must email your request to MyHR@glic.com , making sure to provide your name and job requisition identification number. Guardian will retain your applicant materials and resume and all information therefrom in accordance with Guardian’s document retention policy, a copy of which you may request via MyHR@glic.com . Additionally, at applicable times, Guardian will make public the most recent bias audit results for such AI tools, which may be found here . Current Guardian Colleagues: Please apply through the internal Jobs Hub in Workday.",New York,,2026-04-24,R000109081,Hybrid - In office 3 days per week,https://guardianlife.wd5.myworkdayjobs.com/Guardian-Life-Careers/job/New-York/Head-of-High-Net-Worth-Sales_R000109081
